title,url,domain,seendate,_query
Japan must lower dependence on Middle East crude : PAJ,https://www.argusmedia.com/en/news-and-insights/latest-market-news/2829724-japan-must-lower-dependence-on-middle-east-crude-paj,argusmedia.com,20260521T101500Z,"""crude oil"" sanctions"
US imposes sanctions on a China - based oil refinery and 40 shippers over Iranian oil,https://panow.com/2026/04/24/us-imposes-sanctions-on-a-china-based-oil-refinery-and-40-shippers-over-iranian-oil/,panow.com,20260424T224500Z,"""crude oil"" sanctions"
US Treasury sanctions crackdown on Chinese Teapot refinery and 40 shipping firms & vessels to pressure Iranian oil revenue,https://news.webindia123.com/news/Articles/Business/20260427/4444110.html,news.webindia123.com,20260427T093000Z,"""crude oil"" sanctions"
US sanctions Chinese refinery and 40 firms over Iranian oil trade,https://www.thehindubusinessline.com/news/world/us-sanctions-china-based-refinery-40-shippers-over-iranian-oil/article70904295.ece,thehindubusinessline.com,20260425T011500Z,"""crude oil"" sanctions"
Eleven India - bound vessels have crossed Strait of Hormuz since signing of Iran - US MoU : MEA,https://economictimes.indiatimes.com/industry/energy/oil-gas/eleven-india-bound-vessels-have-crossed-strait-of-hormuz-since-signing-of-iran-us-mou-mea/articleshow/131934908.cms,economictimes.indiatimes.com,20260623T114500Z,"""crude oil"" sanctions"
"Iranian oil may return , but Indian refiners eye concessions",https://www.livemint.com/economy/iran-crude-oil-west-asia-war-indian-refiners-us-sanctions-11782380443425.html,livemint.com,20260626T024500Z,"""crude oil"" sanctions"
US Eases Iran Oil Sanctions With 60 - Day Waiver As Switzerland Talks Advance,https://www.newsx.com/world/us-eases-iran-oil-sanctions-with-60-day-waiver-as-switzerland-talks-advance-239425/,newsx.com,20260622T174500Z,"""crude oil"" sanctions"
Reuters : US lifts Iran oil sanctions until August 21 – Shafaqna English | International Shia News & Fatwas,https://en.shafaqna.com/457782/reuters-us-lifts-iran-oil-sanctions-until-august-21/,en.shafaqna.com,20260625T063000Z,"""crude oil"" sanctions"
Korean firms reportedly among backers of $300B Iran postwar investment fund,http://english.hani.co.kr/arti/english_edition/e_international/1264019.html,english.hani.co.kr,20260617T124500Z,"""crude oil"" sanctions"
  Oil supplies to India increased : Russian foreign minister Lavrov backs strong energy partnership,https://timesofindia.indiatimes.com/business/india-business/oil-supplies-to-india-increased-russian-foreign-minister-lavrov-backs-strong-energy-partnership/articleshow/131121820.cms,timesofindia.indiatimes.com,20260515T170000Z,"""crude oil"" sanctions"
Treasury Sanctions Chinese Refinery and 40 Ships in Sweeping Iran Oil Crackdown,https://townhall.com/tipsheet/scott-mcclallen/2026/04/24/treasury-sanctions-chinese-refinery-and-40-ships-in-sweeping-iran-oil-crackdown-n2675043,townhall.com,20260425T024500Z,"""crude oil"" sanctions"
China Claims to Find Substantial Domestic Oil and Gas Fields,https://www.breitbart.com/national-security/2026/04/30/china-claims-to-find-substantial-domestic-oil-and-gas-fields/,breitbart.com,20260501T181500Z,"""crude oil"" sanctions"
Payment issue ? Govt reacts after Iranian oil tanker diverts from India to China,https://www.rediff.com/news/report/payment-issue-govt-reacts-after-iranian-oil-tanker-diverts-from-india-to-china/20260404.htm,rediff.com,20260404T123000Z,"""crude oil"" sanctions"
Iran Funds Unfrozen into US - Run Escrow Account,https://punchng.com/unfrozen-iran-funds-to-go-into-us-run-escrow-account-trump/,punchng.com,20260623T124500Z,"""crude oil"" sanctions"
US - Iran war : From Russia to Middle East - how India is managing to secure its crude oil supplies amid disruptions,https://timesofindia.indiatimes.com/business/india-business/us-iran-war-from-russia-to-middle-east-how-india-is-managing-to-secure-its-crude-oil-supplies-amid-strait-of-hormuz-disruptions/articleshow/131198401.cms,timesofindia.indiatimes.com,20260519T131500Z,"""crude oil"" sanctions"
U . S . authorizes Iranian oil sales for 60 days as part of peace deal ( USO : NYSEARCA ) ,https://seekingalpha.com/news/4605689-us-authorizes-iranian-oil-sales-for-60-days-as-part-of-peace-deal,seekingalpha.com,20260622T170000Z,"""crude oil"" sanctions"
Crude oil nears four - month low as Strait of Hormuz flows normalise ; can prices fall below $50 ? ,https://www.livemint.com/market/commodities/crude-oil-prices-drop-near-four-month-low-as-strait-of-hormuz-flows-normalize-can-oil-sink-below-50-a-barrel-11782288678513.html,livemint.com,20260624T091500Z,"""crude oil"" sanctions"
India Declines Sanctioned Russian LNG Amid US Pressure & Middle East Energy Crisis : Report,https://www.freepressjournal.in/business/india-declines-sanctioned-russian-lng-amid-us-pressure-middle-east-energy-crisis-report,freepressjournal.in,20260513T040000Z,"""crude oil"" sanctions"
France seizes another sanctioned tanker carrying Russian oil,https://edition.cnn.com/2026/06/01/europe/france-russian-tanker-intl,edition.cnn.com,20260601T130000Z,"""oil tanker"" seized"
"US Coast Guard , Homeland Security seize $6 . 4 Million in narcotics from oil tanker",https://komonews.com/news/nation-world/us-coast-guard-homeland-security-seize-64-million-in-narcotics-from-oil-tanker-los-angeles-cocaine-dhs,komonews.com,20260526T161500Z,"""oil tanker"" seized"
Families of Pakistani hostages held by Somali pirates call for their rescue,https://article.wn.com/view/2026/05/14/Families_of_Pakistani_hostages_held_by_Somali_pirates_call_f/,article.wn.com,20260514T120000Z,"""oil tanker"" seized"
French special forces board Russian Shadow Fleet oil tanker in Atlantic,https://www.thejournal.ie/france-seizes-tagor-russian-shadow-fleet-ship-7057938-Jun2026/,thejournal.ie,20260601T200000Z,"""oil tanker"" seized"
US military says it has seized another oil tanker associated with Iran,https://www.echo-news.co.uk/news/national/26047008.us-military-says-seized-another-oil-tanker-associated-iran/,echo-news.co.uk,20260423T120000Z,"""oil tanker"" seized"
Pirates seize another vessel off Somali coast as threat level increased,http://www.businessghana.com/site/news/politics/347632/Pirates-seize-another-vessel-off-Somali-coast-as-threat-level-increased,businessghana.com,20260428T064500Z,"""oil tanker"" seized"
"Yemen says oil tanker hijacked off Shabwa coast , heads towards Somali waters",https://www.jpost.com/middle-east/article-894877,jpost.com,20260502T133000Z,"""oil tanker"" seized"
US seizes oil tanker allegedly affiliated with Iran,https://en.apa.az/america/us-seizes-oil-tanker-allegedly-affiliated-with-iran-507136,en.apa.az,20260520T020000Z,"""oil tanker"" seized"
Iran army says seized oil tanker in Sea of Oman,https://www.middleeasteye.net/live-blog/live-blog-update/iran-army-says-seized-oil-tanker-sea-oman,middleeasteye.net,20260508T110000Z,"""oil tanker"" seized"
US military says it seizes another oil tanker associated with Iran,https://www.wwaytv3.com/us-military-says-it-seizes-another-oil-tanker-associated-with-iran/,wwaytv3.com,20260423T144500Z,"""oil tanker"" seized"
Somalia : Pirates Seize Another Vessel Off Somali Coast As Threat Level Increased,https://allafrica.com/stories/202604270216.html,allafrica.com,20260427T100000Z,"""oil tanker"" seized"
"April 24 , 2026",https://kaieteurnewsonline.com/2026/04/24/,kaieteurnewsonline.com,20260424T054500Z,"""oil tanker"" seized"
U . S . seizes Majestic X tanker in Indian Ocean,https://www.wtae.com/article/us-military-seizes-majestic-x-iranian-oil-smuggling/71106335,wtae.com,20260423T123000Z,"""oil tanker"" seized"
World News : Oil tanker seized in Indian Ocean,https://www.gdnonline.com:443/Details/1395340,gdnonline.com,20260520T003000Z,"""oil tanker"" seized"
"Yemen says gunmen seize oil tanker , heading to Somalia waters",https://www.yahoo.com/news/articles/yemen-says-gunmen-seize-oil-152324150.html,yahoo.com,20260502T161500Z,"""oil tanker"" seized"
Iran Navy seizes oil tanker Ocean Koi off Gulf of Oman over maritime violations,https://www.globalsecurity.org/wmd/library/news/iran/2026/05/iran-260508-presstv10.htm,globalsecurity.org,20260510T113000Z,"""oil tanker"" seized"
Britain seizes Russian oil tanker in English Channel amid rising tensions with Moscow,https://www.globalsecurity.org/wmd/library/news/russia/2026/06/russia-260614-presstv01.htm,globalsecurity.org,20260615T123000Z,"""oil tanker"" seized"
"Oil tanker hijacked off coast of Yemen , says coast guard",https://www.middleeasteye.net/live-blog/live-blog-update/oil-tanker-hijacked-coast-yemen-says-coast-guard,middleeasteye.net,20260502T144500Z,"""oil tanker"" seized"
Iran seizes oil tanker Ocean Koi,https://www.emirates247.com/world/iran-seizes-oil-tanker-ocean-koi/1420,emirates247.com,20260508T123000Z,"""oil tanker"" seized"
Trump : US Navy to target mine - laying boats in Hormuz,https://www.hurriyetdailynews.com/trump-us-navy-to-target-mine-laying-boats-in-hormuz-221403,hurriyetdailynews.com,20260423T151500Z,"""oil tanker"" seized"
"Oil Tanker Hijacked off Yemen , Diverted Towards Somalia",https://english.aawsat.com/arab-world/5268858-oil-tanker-hijacked-yemen-diverted-towards-somalia,english.aawsat.com,20260502T160000Z,"""oil tanker"" seized"
Security team repels suspicious approach off Yemen Socotra Island : united kingdom maritime agency,https://news.webindia123.com/news/Articles/World/20260522/4453156.html,news.webindia123.com,20260522T120000Z,"""oil tanker"" seized"
"$10 million ransom : Somali pirates kidnap , terrorize Egyptian sailors ( Video ) ",https://www.albawaba.com/node/10-million-ransom-somali-pirates-kidnap-1628141,albawaba.com,20260520T071500Z,"""oil tanker"" seized"
"Oil Tanker Hijacked Off Shabwa Coast , Heads Towards Somali Waters",https://gcaptain.com/oil-tanker-hijacked-off-shabwa-coast-heads-towards-somali-waters/,gcaptain.com,20260502T223000Z,"""oil tanker"" seized"
U . S . seizes Iran - linked oil tanker in Indian Ocean : report,http://www.bruneinews.net/news/279061972/us-seizes-iran-linked-oil-tanker-in-indian-ocean-report,bruneinews.net,20260520T000000Z,"""oil tanker"" seized"
U . S . seizes Iran - linked oil tanker in Indian Ocean : report - Xinhua,https://english.news.cn/northamerica/20260520/05bcd1dd98e94213a33666a9359589f9/c.html,english.news.cn,20260519T234500Z,"""oil tanker"" seized"
US and Iran continue seizing ships in tense Hormuz standoff,https://www.euronews.com/2026/04/23/us-and-iran-continue-seizing-ships-in-tense-hormuz-standoff,euronews.com,20260423T151500Z,"""oil tanker"" seized"
Trump orders military to  shoot and kill  Iranian small boats choking Strait of Hormuz,https://www.newindianexpress.com/world/2026/Apr/23/trump-orders-military-to-shoot-and-kill-iranian-small-boats-choking-strait-of-hormuz,newindianexpress.com,20260423T161500Z,"""oil tanker"" seized"
Iran seizes US - sanctioned tanker carrying Islamic regime oil in Gulf of Oman,https://nypost.com/2026/05/08/world-news/iran-seizes-us-sanctioned-tanker-carrying-islamic-regimes-oil-in-gulf-of-oman/,nypost.com,20260508T124500Z,"""oil tanker"" seized"
What happened to crew of seized Russian  shadow fleet  tanker ? ,https://www.bbc.co.uk/news/articles/cx2kndwk20do,bbc.co.uk,20260626T183000Z,"""oil tanker"" seized"
Families seek urgent action as Somali pirates hold Pakistani crew,https://tribune.com.pk/story/2605751/families-seek-urgent-action-as-somali-pirates-hold-pakistani-crew,tribune.com.pk,20260430T234500Z,"""oil tanker"" seized"
U . S . seizes Iran - linked oil tanker in Indian Ocean | Hellenic Shipping News Worldwide,https://www.hellenicshippingnews.com/u-s-seizes-iran-linked-oil-tanker-in-indian-ocean/,hellenicshippingnews.com,20260520T111500Z,"""oil tanker"" seized"
Pirates seize oil tanker with 11 Pakistanis onboard off Somalia,https://www.geo.tv/latest/661553-pirates-seize-oil-tanker-with-11-pakistanis-onboard-off-somalia,geo.tv,20260425T091500Z,"""oil tanker"" seized"
Somalia promises assistance for safe return of Pakistani crew held by pirates,https://pakobserver.net/somalia-promises-assistance-for-safe-return-of-pakistani-crew-held-by-pirates/,pakobserver.net,20260430T041500Z,"""oil tanker"" seized"
"In First , united kingdom Seizes Russian  Shadow Fleet  Tanker",https://www.newser.com/story/391006/uk-seizes-suspected-russian-shadow-fleet-tanker.html,newser.com,20260614T140000Z,"""oil tanker"" seized"
US military boards Iranian oil tanker suspected of breaching blockade,https://timesofindia.indiatimes.com/world/us/us-military-boards-iranian-oil-tanker-suspected-of-breaching-blockade/articleshow/131237567.cms,timesofindia.indiatimes.com,20260520T230000Z,"""oil tanker"" seized"
Oil Tanker Security Team Fires Warning Shots Near Yemen Socotra,https://www.newkerala.com/news/a/security-team-repels-suspicious-approach-off-yemens-socotra-280.htm,newkerala.com,20260522T111500Z,"""oil tanker"" seized"
"Oil tanker hijacked off Yemen , diverted to Somalia - Pakistan Today",https://www.pakistantoday.com.pk/2026/05/02/oil-tanker-hijacked-off-yemen-and-diverted-towards-somalia-says-coast-guard,pakistantoday.com.pk,20260502T194500Z,"""oil tanker"" seized"
Ship reported seized off the coast of the UAE,https://morningstaronline.co.uk/article/ship-reported-seized-coast-uae,morningstaronline.co.uk,20260514T184500Z,"""oil tanker"" seized"
"Suspected pirates seize vessel carrying cement off Somalia , the second hijacking incident in days – Winnipeg Free Press",https://www.winnipegfreepress.com/business/2026/04/27/suspected-pirates-seize-vessel-carrying-cement-off-somalia-the-second-hijacking-incident-in-days,winnipegfreepress.com,20260427T121500Z,"""oil tanker"" seized"
Families call for immediate rescue as Pakistani crew held by Somali pirates,https://pakobserver.net/families-call-for-immediate-rescue-as-pakistani-crew-held-by-somali-pirates/,pakobserver.net,20260427T141500Z,"""oil tanker"" seized"
US seizes Iran - linked  shadow fleet  tanker in Indian Ocean amid Trump strike threats,https://www.thehindubusinessline.com/news/world/us-seizes-iran-linked-shadow-fleet-tanker-in-indian-ocean-amid-trumps-strike-threats/article71001270.ece,thehindubusinessline.com,20260520T100000Z,"""oil tanker"" seized"
"​Iran says it seizes  offending  oil tanker , US disables two vessels",https://www.ibtimes.co.in/iran-says-it-seizes-offending-oil-tanker-us-disables-two-vessels-901893,ibtimes.co.in,20260509T003000Z,"""oil tanker"" seized"
"US targets Iranian oil network , captures second tanker in Indian Ocean",https://en.apa.az/america/us-targets-iranian-oil-network-captures-second-tanker-in-indian-ocean-502915,en.apa.az,20260423T150000Z,"""oil tanker"" seized"
Sanctioned oil tanker seized by U . S . ,https://kaieteurnewsonline.com/2026/04/24/sanctioned-oil-tanker-seized-by-u-s/,kaieteurnewsonline.com,20260424T054500Z,"""oil tanker"" seized"
Russian frigate reportedly fires warning shots at British yacht in Channel,https://www.irishtimes.com/world/europe/2026/06/16/russian-frigate-reportedly-fires-warning-shots-at-british-yacht-in-channel/,irishtimes.com,20260616T174500Z,"""oil tanker"" seized"
"Vessel off UAE coast  taken , now bound for Iran waters",https://www.naharnet.com:443/stories/en/320134-vessel-off-uae-coast-taken-now-bound-for-iran-waters,naharnet.com,20260514T120000Z,"""oil tanker"" seized"
Barbados warns of  false flag  trend after Iran claims oil vessel capture,https://barbadostoday.bb/2026/05/09/barbados-warns-of-false-flag-trend-after-iran-claims-oil-vessel-capture/,barbadostoday.bb,20260509T194500Z,"""oil tanker"" seized"
"New EU Russia Sanctions to Target Energy Revenue , Banks",https://foreignpolicy.com/2026/06/10/europe-russia-sanctions-package-trump-putin/?tpcc=recirc_trending062921,foreignpolicy.com,20260610T204500Z,"""russia"" oil sanctions"
"EU Prepares 21st Russia Sanctions Package , Targeting Oil Revenues and Shadow Fleet",https://www.kyivpost.com/post/77379,kyivpost.com,20260602T180000Z,"""russia"" oil sanctions"
Trump imposed toughest Russia oil sanctions : Bessent,https://www.prokerala.com/news/articles/a1768669.html,prokerala.com,20260529T023000Z,"""russia"" oil sanctions"
France Seizes Another Russia - Linked Oil Tanker as Ukrainian Drones Hit Russian Oil Depots,https://news.antiwar.com/2026/06/25/france-seizes-another-russia-linked-oil-tanker-as-ukrainian-drones-hit-russian-oil-depots/,news.antiwar.com,20260626T001500Z,"""russia"" oil sanctions"
"Ukraine Syncs With 20th EU Sanctions Package , Targeting Russian Oil Giant , Drone Industry Firms , Belarus , Iran",https://www.kyivpost.com/post/77291,kyivpost.com,20260601T180000Z,"""russia"" oil sanctions"
India Rejects Russian LNG Under Sanctions,https://oilprice.com/Latest-Energy-News/World-News/India-Rejects-Russian-LNG-Under-Sanctions.html,oilprice.com,20260511T181500Z,"""russia"" oil sanctions"
EU proposes freezing Russian oil price cap to prevent windfall for Kremlin war chest – POLITICO,https://www.politico.eu/article/eu-proposes-freezing-russian-oil-price-cap-to-prevent-windfall-for-kremlins-war-chest/,politico.eu,20260609T133000Z,"""russia"" oil sanctions"
Bipartisan US senators introduce bill to tighten oversight of Russia sanctions,https://aa.com.tr/en/americas/bipartisan-us-senators-introduce-bill-to-tighten-oversight-of-russia-sanctions/3917456,aa.com.tr,20260425T004500Z,"""russia"" oil sanctions"
Zelenskyy : Russia loses $7 bln since beginning of year from Ukrainian long - range sanctions against oil industry,https://en.interfax.com.ua/news/general/1164078.html,en.interfax.com.ua,20260501T131500Z,"""russia"" oil sanctions"
"EU Sanctions Package Includes Indian Entities , Threatens Trade Deal – NaturalNews . com",https://www.naturalnews.com/2026-06-12-eu-sanctions-package-includes-indian-entities.html,naturalnews.com,20260612T150000Z,"""russia"" oil sanctions"
Procurement : The Dissolution of the Russian Economy,http://www.strategypage.com/htmw/htproc/articles/2026052455651.aspx,strategypage.com,20260524T121500Z,"""russia"" oil sanctions"
India Accuses West of Double Standards Over U . S . Russia Oil Sanctions,https://oilprice.com/Latest-Energy-News/World-News/India-Accuses-West-of-Double-Standards-Over-US-Russia-Oil-Sanctions.html,oilprice.com,20260612T144500Z,"""russia"" oil sanctions"
EU Approves $105 Billion Loan for Ukraine Amid New Sanctions on Russia | World News,https://timesofindia.indiatimes.com/world/europe/eu-signs-off-on-ukraine-loan-new-russia-sanctions/articleshow/130469349.cms,timesofindia.indiatimes.com,20260423T150000Z,"""russia"" oil sanctions"
India - based entities among firms targeted in EU proposed 21st Russia sanctions package,https://economictimes.indiatimes.com/news/india/eu-targets-india-based-companies-in-major-sanctions-package-against-russia/articleshow/131629339.cms,economictimes.indiatimes.com,20260610T084500Z,"""russia"" oil sanctions"
Zelensky slams oil sanctions relief for Russia,https://www.hurriyetdailynews.com/zelensky-slams-oil-sanctions-relief-for-russia-221221,hurriyetdailynews.com,20260419T133000Z,"""russia"" oil sanctions"
U . K . Eases Some Russian Oil Sanctions as Fuel Prices Soar – NaturalNews . com,https://www.naturalnews.com/2026-05-22-united-kingdom-eases-some-russian-oil-sanctions.html,naturalnews.com,20260522T163000Z,"""russia"" oil sanctions"
EU plans entry ban for Russian soldiers who served during Ukraine war,https://www.yahoo.com/news/politics/articles/eu-plans-entry-ban-russian-122533273.html,yahoo.com,20260609T130000Z,"""russia"" oil sanctions"
France intercepts Russian - linked oil tanker | The Jerusalem Post,http://www.jpost.com/international/article-898052,jpost.com,20260602T033000Z,"""russia"" oil sanctions"
"French Navy boards Russian oil tanker , PM Emmanuel Macron states",https://www.jpost.com/international/article-897954,jpost.com,20260601T090000Z,"""russia"" oil sanctions"
Ukraine Ally Britain Eases Sanctions on Russian Oil as Fuel Prices Surge Over Iran Conflict,https://english.aawsat.com/business/5275248-ukraine-ally-britain-eases-sanctions-russian-oil-fuel-prices-surge-over-iran,english.aawsat.com,20260520T114500Z,"""russia"" oil sanctions"
Russia Oil Revenues Rise $6 . 3 Billion as High Prices Offset Production Declines – NaturalNews . com,https://www.naturalnews.com/2026-05-14-russia-oil-revenues-rise-costs-offset-production-declines.html,naturalnews.com,20260515T030000Z,"""russia"" oil sanctions"
Macron says French Navy intercepted sanctioned tanker from Russia,https://www.thetimes-tribune.com/2026/06/01/macron-french-navy-sanctioned-russia-tanker/,thetimes-tribune.com,20260601T151500Z,"""russia"" oil sanctions"
Ukraine ally Britain eases new sanctions on Russian oil as fuel prices surge over Iran war,https://www.ksat.com/news/2026/05/20/ukraine-ally-britain-eases-new-sanctions-on-russian-oil-as-fuel-prices-surge-over-iran-war/,ksat.com,20260520T170000Z,"""russia"" oil sanctions"
"Sanctions Update : June 22 , 2026",https://www.mondaq.com:443/unitedstates/export-controls-trade-investment-sanctions/1805086/sanctions-update-june-22-2026,mondaq.com,20260622T221500Z,"""russia"" oil sanctions"
Ukraine ally Britain eases sanctions on Russian oil as fuel prices surge over Iran conflict,https://www.thehindu.com/news/international/ukraine-ally-britain-eases-sanctions-on-russian-oil-as-fuel-prices-surge-over-iran-conflict/article71002042.ece,thehindu.com,20260520T131500Z,"""russia"" oil sanctions"
"EU unveils new sanctions package against Russia , expands pressure on financial , energy sectors",https://aa.com.tr/en/europe/eu-unveils-new-sanctions-package-against-russia-expands-pressure-on-financial-energy-sectors/3961469,aa.com.tr,20260609T154500Z,"""russia"" oil sanctions"
EU envoys poised to adopt 20th package of Russia sanctions : Diplomats,https://www.lbcgroup.tv/news/world-news/926942/eu-envoys-poised-to-adopt-20th-package-of-russia-sanctions-diplomats/en,lbcgroup.tv,20260423T221500Z,"""russia"" oil sanctions"
Bessent grants a 30 - day extension for Russian oil in tankers as Iran war squeezes supply,https://www.yahoo.com/news/articles/bessent-grants-30-day-extension-180829159.html,yahoo.com,20260518T193000Z,"""russia"" oil sanctions"
Indian entities on latest EU sanctions package on Russia,https://www.thehindu.com/news/international/indian-entities-on-latest-eu-sanctions-package-on-russia/article71082069.ece,thehindu.com,20260609T170000Z,"""russia"" oil sanctions"
EU targets Russian economy and soldiers in newest sanction package,https://www.politico.eu/article/eu-russia-economy-soldiers-sanction-package/,politico.eu,20260609T160000Z,"""russia"" oil sanctions"
UK struggles to reassure Ukraine after easing new sanctions on Russian oil,https://www.theguardian.com/world/2026/may/20/uk-struggles-to-reassure-ukraine-after-easing-new-sanctions-on-russian-oil,theguardian.com,20260520T194500Z,"""russia"" oil sanctions"
Ukraine ally Britain eases sanctions on Russian oil as fuel prices surge over Iran conflict – Winnipeg Free Press,https://www.winnipegfreepress.com/world/2026/05/20/ukraine-ally-britain-eases-sanctions-on-russian-oil-as-fuel-prices-surge-over-iran-conflict,winnipegfreepress.com,20260520T100000Z,"""russia"" oil sanctions"
US extends sanctions waiver on Russian oil as supply crunch pushes up Brent crude price,https://www.theguardian.com/us-news/2026/may/19/us-extends-sanctions-waiver-russian-oil-second-time,theguardian.com,20260519T020000Z,"""russia"" oil sanctions"
"Ukraine aligns new sanctions with EU 20th package putting drone makers , propagandists , Slavneft on list",https://en.interfax.com.ua/news/general/1172605.html,en.interfax.com.ua,20260601T130000Z,"""russia"" oil sanctions"
PM  reaffirm Ukraine backing in call with Zelensky amid sanctions criticism,https://www.kentonline.co.uk/news/national/pm-reaffirms-ukraine-backing-in-call-with-zelensky-amid-sanctions-criticism-166962/,kentonline.co.uk,20260520T220000Z,"""russia"" oil sanctions"
U . S . extends temporary Russia sanctions relief for 3rd straight month,https://www.upi.com/Top_News/US/2026/05/19/Russia-oil-waiver-extended/5771779176533/,upi.com,20260519T111500Z,"""russia"" oil sanctions"
India ship certifier takes tougher stance on sanctioned tankers,https://www.moneycontrol.com/news/business/india-s-ship-certifier-takes-tougher-stance-on-sanctioned-tankers-13945301.html,moneycontrol.com,20260609T150000Z,"""russia"" oil sanctions"
"Russian shadow fleet enabled by EU - linked insurers , investigators say",https://www.politico.eu/article/russia-shadow-fleet-oil-sanctions-eu-insurance/,politico.eu,20260602T030000Z,"""russia"" oil sanctions"
  Stop doing favors for Mr Putin : WSJ rakes Trump over coals for latest Russia gift,https://www.rawstory.com/trump-putin-2676695766/,rawstory.com,20260410T014500Z,"""russia"" oil sanctions"
France intercepts another  shadow fleet  tanker linked to Russian oil,https://www.freemalaysiatoday.com/category/business/2026/06/02/france-intercepts-another-shadow-fleet-tanker-linked-to-russian-oil,freemalaysiatoday.com,20260602T043000Z,"""russia"" oil sanctions"
US Extends Russian Oil Waiver As Bessent Urges Tougher Iran Sanctions,https://www.rferl.org/a/us-renews-russian-oil-waiver-iran-conflict-energy-markets/33759619.html,rferl.org,20260518T183000Z,"""russia"" oil sanctions"
EU proposes 21st package of sanctions against Russia,https://www.globalsecurity.org/wmd/library/news/russia/2026/06/russia-260609-pdo01.htm,globalsecurity.org,20260610T120000Z,"""russia"" oil sanctions"
"Macron says French Navy , backed by the united kingdom , intercepted a sanctioned tanker from Russia",https://www.durangoherald.com/articles/macron-says-french-navy-backed-by-the-uk-intercepted-a-sanctioned-tanker-from-russia/,durangoherald.com,20260601T111500Z,"""russia"" oil sanctions"
UK to set end date for imports of Russian diesel and jet fuel via third countries,https://www.globalsecurity.org/wmd/library/news/russia/2026/06/russia-260612-ukfcdo01.htm,globalsecurity.org,20260613T123000Z,"""russia"" oil sanctions"
