title,url,domain,seendate,_query
"Chalmette refinery explosion caused no air quality threat , officials say",https://www.wwltv.com/article/news/local/st-bernard/chalmette-refinery-explosion-caused-no-air-quality-threat-officials-say/289-580f80e3-1f71-48f7-b2ca-f2211743fa17,wwltv.com,20260515T223000Z,"""refinery"" fire"
Fire erupts at India Rajasthan refinery a day ahead of inauguration,https://www.albawaba.com/news/fire-erupts-india%E2%80%99s-rajasthan-refinery-1625859,albawaba.com,20260420T170000Z,"""refinery"" fire"
What we know about the Geelong refinery fire  war zone  ,https://www.abc.net.au/news/2026-04-17/geelong-refinery-fire-visual-explainer/106571216,abc.net.au,20260416T193000Z,"""refinery"" fire"
  Not doing that : Deputy PM major call on fuel supply after Geelong refinery blaze,https://www.perthnow.com.au/news/not-doing-that-deputy-pms-major-call-on-fuel-supply-after-geelong-refinery-blaze-c-22153533,perthnow.com.au,20260416T233000Z,"""refinery"" fire"
Massive blaze engulfs Geelong oil refinery in Australia,https://www.albawaba.com/news/massive-blaze-engulfs-geelong-oil-1625600,albawaba.com,20260415T184500Z,"""refinery"" fire"
"Fire breaks out at Viva Energy oil refinery in Geelong , Australia",https://www.nzherald.co.nz/world/fire-breaks-out-at-viva-energy-oil-refinery-in-victoria-australia/EBAUEQRKBFCEPG3YJOU7UM5WZI/,nzherald.co.nz,20260416T001500Z,"""refinery"" fire"
"Ukraine strikes Russian oil refinery , rejects Moscow nuclear plant attack claims",https://www.moneycontrol.com/world/ukraine-strikes-russian-oil-refinery-rejects-moscow-s-nuclear-plant-attack-claims-article-13936778.html,moneycontrol.com,20260531T133000Z,"""refinery"" fire"
"The Urals no longer a rear area : in April , Ukrainian deep strike operations hit 14 refineries and terminals , 2 plants , as well as russian vessels and aircraft",https://www.globalsecurity.org/wmd/library/news/ukraine/2026/05/ukraine-260504-ukraine-mod01.htm,globalsecurity.org,20260505T104500Z,"""refinery"" fire"
"Ukraine Hits 300 , 000 - Bpd Gazprom Neft Refinery in Overnight Drone Strike",https://oilprice.com/Latest-Energy-News/World-News/Ukraine-Hits-300000-Bpd-Gazprom-Neft-Refinery-in-Overnight-Drone-Strike.html,oilprice.com,20260522T163000Z,"""refinery"" fire"
Viva Energy resumes trading four days after Geelong refinery went up in flames,https://www.perthnow.com.au/news/viva-energy-resumes-trading-four-days-after-geelong-refinery-went-up-in-flames-c-22163733,perthnow.com.au,20260420T010000Z,"""refinery"" fire"
"Fire - hit HRRL back on track , starts production of key petroleum products",https://timesofindia.indiatimes.com/business/india-business/fire-hit-hrrl-back-on-track-starts-production-of-key-petroleum-products/articleshow/131863471.cms,timesofindia.indiatimes.com,20260619T181500Z,"""refinery"" fire"
Pictures show large fire at HF Sinclair Refinery in Tulsa,https://www.koco.com/article/tulsa-oklahoma-hf-sinclair-refinery-fire/71272290,koco.com,20260511T214500Z,"""refinery"" fire"
Ukraine hits two Russian oil refineries in overnight drone strikes,https://www.moneycontrol.com/world/ukraine-hits-two-russian-oil-refineries-in-overnight-drone-strikes-article-13960433.html,moneycontrol.com,20260628T103000Z,"""refinery"" fire"
  Blaze not yet under control : Fire breaks out at Viva Energy Geelong refinery in Australia,https://timesofindia.indiatimes.com/world/rest-of-world/blaze-not-yet-under-control-fire-breaks-out-at-viva-energys-geelong-refinery-in-australia/articleshow/130293502.cms,timesofindia.indiatimes.com,20260415T233000Z,"""refinery"" fire"
  Raining Oil  – Drone Strikes Trigger  Man - Made Disaster  in Tuapse,https://www.kyivpost.com/post/74503,kyivpost.com,20260422T151500Z,"""refinery"" fire"
Ukrainian Drones Strike Oil Refinery Deep Inside Russia,https://www.rferl.org/a/ukrainian-drones-strike-oil-refinery-deep-inside-russia/33769483.html,rferl.org,20260531T130000Z,"""refinery"" fire"
Ukrainian Drone Strikes in Volgograd and Bryansk Kill 3,https://www.themoscowtimes.com/2026/05/29/ukrainian-drone-strikes-in-volgograd-and-bryansk-kill-3-a92878,themoscowtimes.com,20260529T091500Z,"""refinery"" fire"
Russian glide bomb attack kills five as Ukrainian drones hit Siberian oil refinery,https://www.lbc.co.uk/article/russia-glide-bomb-five-dead-ukraine-attack-siberian-oil-refinery-5Hjdbs8_2/,lbc.co.uk,20260621T104500Z,"""refinery"" fire"
"Explosion at Chalmette Refinery shakes nearby businesses , no injuries reported",https://www.fox8live.com/2026/05/08/explosion-chalmette-refinery-shakes-nearby-businesses-no-injuries-reported/,fox8live.com,20260509T003000Z,"""refinery"" fire"
"Ukrainian drone attack on Russian oil refinery causes major fire , officials say",https://www.scmp.com/news/world/russia-central-asia/article/3351733/ukrainian-drone-attack-russian-oil-refinery-causes-major-fire-officials-say,scmp.com,20260428T120000Z,"""refinery"" fire"
"Several injured in fire near unauthorised theft point near Haldia refinery , company says",https://www.straitstimes.com/asia/several-injured-in-fire-near-unauthorised-theft-point-near-haldia-refinery-company-says,straitstimes.com,20260630T050000Z,"""refinery"" fire"
Viva Energy says Australians will not experience fuel supply shock despite reduced refinery capacity,https://www.abc.net.au/news/2026-04-18/victoria-geelong-corio-oil-refinery-fire-viva-energy/106576698,abc.net.au,20260417T214500Z,"""refinery"" fire"
Blaze tears through Australian refinery ; disruptions feared,https://www.taipeitimes.com/News/front/archives/2026/04/17/2003855748,taipeitimes.com,20260416T164500Z,"""refinery"" fire"
Russia in flames as Ukraine obliterates key target in insane bombing,https://www.express.co.uk/news/world/2211788/ukraine-drone-russia-war-energy-infrastructure,express.co.uk,20260601T070000Z,"""refinery"" fire"
Massive fire breaks out at India first greenfield refinery complex day before PM Modi scheduled inauguration,https://www.livemint.com/news/india/massive-fire-breaks-out-at-indias-first-greenfield-refinery-complex-day-before-pm-modi-s-scheduled-inauguration-11776686887458.html,livemint.com,20260420T143000Z,"""refinery"" fire"
"Tulsa fire chief discusses recent major fires , safety concerns",https://www.newson6.com/tulsa-oklahoma-news/tulsa-fire-chief-discusses-recent-major-fires-safety-concerns,newson6.com,20260512T170000Z,"""refinery"" fire"
Anthony Albanese flies home early from Asia to visit site of oil refinery blaze - as scrutiny grows over what sparked the  very unusual  fire,https://www.dailymail.co.uk/news/article-15740403/Anthony-Albanese-viva-energy-oil-refinery-fire.html,dailymail.co.uk,20260416T224500Z,"""refinery"" fire"
Ukraine hits Russian energy targets and denies striking Kremlin - occupied nuclear plant,https://www.orlandosentinel.com/2026/05/31/ukraine-hits-russian-energy-targets-and-denies-striking-kremlin-occupied-nuclear-plant/,orlandosentinel.com,20260531T143000Z,"""refinery"" fire"
Fuel production slows as flames engulf refinery,https://www.examiner.com.au/story/9225113/fuel-production-slows-as-flames-engulf-refinery/,examiner.com.au,20260416T031500Z,"""refinery"" fire"
HPCL says Rajasthan refinery Crude Distillation Unit to restart in May after fire incident,https://economictimes.indiatimes.com/industry/energy/oil-gas/hpcl-says-rajasthan-refinerys-crude-distillation-unit-to-restart-in-may-after-fire-incident/articleshow/130526062.cms,economictimes.indiatimes.com,20260426T051500Z,"""refinery"" fire"
"Security Lapse at PM Modi Event in Balotra , Man Accesses VVIP Stage",https://dailypioneer.com/news/security-lapse-in-balotra-man-enters-vvip-stage-before-pm-event,dailypioneer.com,20260424T080000Z,"""refinery"" fire"
How Victorian oil refinery fire will impact Australia,https://www.smh.com.au/national/how-victorian-oil-refinery-fire-will-impact-australia-20260416-p5zokk.html,smh.com.au,20260416T101500Z,"""refinery"" fire"
Ukraine hits Russian energy targets but denies striking nuclear plant,https://www.edp24.co.uk/news/national/26152955.ukraine-hits-russian-energy-targets-denies-striking-nuclear-plant/,edp24.co.uk,20260531T161500Z,"""refinery"" fire"
"Monroe refinery fire visuals : Massive blaze at Marcus Hook Trainer Refinery , residents report smoke",https://www.hindustantimes.com/world-news/us-news/monroe-energy-refinery-fire-visuals-massive-blaze-at-marcus-hook-pa-trainer-refinery-residents-report-smoke-101782405597754.html,hindustantimes.com,20260625T180000Z,"""refinery"" fire"
Prime Minister to visit fire - hit Geelong oil refinery,https://www.smh.com.au/national/prime-minister-to-visit-fire-hit-geelong-oil-refinery-20260417-p5zom6.html,smh.com.au,20260416T211500Z,"""refinery"" fire"
"Cape Town residents report headaches , burning eyes after Astron refinery flicker",https://www.ewn.co.za/2026/06/12/cape-town-residents-report-headaches-burning-eyes-after-astron-refinery-flicker,ewn.co.za,20260612T100000Z,"""refinery"" fire"
Fire at Viva Energy refinery in Geelong,https://www.theage.com.au/business/companies/significant-fire-breaks-out-at-viva-energy-s-refinery-in-geelong-20260416-p5zoa4.html,theage.com.au,20260415T210000Z,"""refinery"" fire"
  Small leak  behind oil refinery blaze that set to impact Australia fuel supply,https://www.sbs.com.au/news/article/oil-refinery-fire-australia-fuel-supply-impact/g7mtm24k6,sbs.com.au,20260416T051500Z,"""refinery"" fire"
Qatar suspends marine activities,https://www.sailingscuttlebutt.com/2026/06/29/qatar-suspends-marine-activities/,sailingscuttlebutt.com,20260629T214500Z,"""persian gulf"" tension"
Hezbollah Openly Threatens to Topple Lebanese Govt and Restart Civil War as Israel Expands Strikes,https://www.haaretz.com/middle-east-news/lebanonnews/2026-05-27/ty-article/.premium/hezbollah-threatens-to-topple-lebanese-govt-as-israel-expands-strikes/0000019e-65eb-d1b9-a9bf-fdef4ff70000,haaretz.com,20260527T003000Z,"""persian gulf"" tension"
Iran president says US naval blockade  doomed to fail  ,https://www.bssnews.net/international/382858,bssnews.net,20260430T083000Z,"""persian gulf"" tension"
"Iran Accuses Kuwait Of Attacking Vessel , Detaining Four Nationals In Persian Gulf",https://saharareporters.com/2026/05/13/iran-accuses-kuwait-attacking-vessel-detaining-four-nationals-persian-gulf,saharareporters.com,20260513T223000Z,"""persian gulf"" tension"
Main developments in Middle East as of Thursday morning,https://news.am/en/news/1035210,news.am,20260514T093000Z,"""persian gulf"" tension"
Khamenei says US suffered  disgraceful defeat  ,https://cdn.naharnet.com/stories/en/319895-khamenei-says-us-suffered-disgraceful-defeat,cdn.naharnet.com,20260501T143000Z,"""persian gulf"" tension"
Trump attacks oil companies - He denounces price gouging and threatens an investigation,https://www.bankingnews.gr/diethni/articles/883899/trump-attacks-oil-companies-he-denounces-price-gouging-and-threatens-an-investigation,bankingnews.gr,20260624T094500Z,"""persian gulf"" tension"
"Iran killed the US security umbrella : Saudi Arabia , the fierce backstage reality , and the new oil routes",https://www.bankingnews.gr/analyseis-ektheseis/articles/884681/iran-killed-the-us-security-umbrella-saudi-arabia-the-fierce-backstage-reality-and-the-new-oil-routes,bankingnews.gr,20260627T141500Z,"""persian gulf"" tension"
Unbelievable : California gas prices hit $8 a gallon –  Fuelmaggedon  looms as anger mounts against Trump,https://www.bankingnews.gr/diethni/articles/872971/unbelievable-california-gas-prices-hit-8-a-gallon-fuelmaggedon-looms-as-anger-mounts-against-trump%20title=,bankingnews.gr,20260505T094500Z,"""persian gulf"" tension"
Internet the next collateral ? Iranian media flags new risk at Hormuz,https://www.businesstoday.in/world/story/internet-the-next-collateral-iranian-media-flags-new-risk-at-hormuz-527000-2026-04-23,businesstoday.in,20260423T040000Z,"""persian gulf"" tension"
"hormuz tanker warning : Strait of Hormuz still closed , and what is IRGC Navy message for vessels in Persian Gulf and Oman Sea ? Latest shipping warning and tanker halt explained",https://economictimes.indiatimes.com/news/international/us/strait-of-hormuz-still-closed-and-what-is-irgc-navys-message-for-vessels-in-persian-gulf-and-oman-sea-latest-shipping-warning-and-tanker-halt-explained/articleshow/130119554.cms,economictimes.indiatimes.com,20260408T171500Z,"""persian gulf"" tension"
Qatar Quietly Sends LNG Tanker Through Hormuz,https://www.rigzone.com/news/wire/qatar_quietly_sends_lng_tanker_through_hormuz-09-jun-2026-183884-article/,rigzone.com,20260609T180000Z,"""persian gulf"" tension"
"US , Iran pause strikes ; clash on talks | The Shillong Times",https://theshillongtimes.com/2026/06/30/us-iran-pause-strikes-clash-on-talks/,theshillongtimes.com,20260630T051500Z,"""persian gulf"" tension"
"Oil Prices Slide After Iran Deal , But Analysts Warn Gasoline Relief Will Take Months – NaturalNews . com",https://www.naturalnews.com/2026-06-21-oil-prices-slide-gasoline-relief-take-months.html,naturalnews.com,20260622T011500Z,"""persian gulf"" tension"
"Safe passage : Indian tanker Desh Garima clears Hormuz amid rising maritime firing incidents , expected to arrive at Mumbai on April 22",https://aninews.in/news/world/asia/safe-passage-indian-tanker-desh-garima-clears-hormuz-amid-rising-maritime-firing-incidents-expected-to-arrive-at-mumbai-on-april-2220260419223647/,aninews.in,20260419T190000Z,"""persian gulf"" tension"
"Gulf Evacuation Warning :  Time Is Running Out  as Iran Adviser Urges Immediate Exit From UAE , Saudi Arabia , Qatar , Bahrain and Kuwait",https://www.ibtimes.com/gulf-evacuation-warning-time-running-out-iran-adviser-urges-immediate-exit-uae-saudi-arabia-3801697,ibtimes.com,20260421T214500Z,"""persian gulf"" tension"
Oil soars after report says Iran is set to halt messages with US,https://www.businesstimes.com.sg/companies-markets/energy-commodities/oil-soars-after-report-says-iran-set-halt-messages-us,businesstimes.com.sg,20260601T181500Z,"""persian gulf"" tension"
"On Persian Gulf Day , Iranian president says naval blockade poses threat to global peace","https://www.presstv.ir/Detail/2026/04/30/767788/On-Persian-Gulf-Day,-Pezeshkian-says-naval-blockade-poses-threat-to-regional-interests,-global-peace-",presstv.ir,20260430T120000Z,"""persian gulf"" tension"
"Iran Vows to Defend Nuclear , Missile Programs as  National Assets  ",https://voiceofvienna.org/iran-vows-to-defend-nuclear-missile-programs-as-national-assets/,voiceofvienna.org,20260501T204500Z,"""persian gulf"" tension"
"DMW : 1 , 200 Pinoy seafarers out of Strait of Hormuz",https://www.sunstar.com.ph/manila/dmw-1200-pinoy-seafarers-out-of-strait-of-hormuz,sunstar.com.ph,20260429T104500Z,"""persian gulf"" tension"
US naval blockade  doomed to fail  - Iran president,https://www.vanguardngr.com/2026/04/us-naval-blockade-doomed-to-fail-iran-president/,vanguardngr.com,20260430T104500Z,"""persian gulf"" tension"
Iran attacks Bahrain and Kuwait following US strikes,https://www.taipeitimes.com/News/front/archives/2026/06/29/2003859908,taipeitimes.com,20260628T163000Z,"""persian gulf"" tension"
US military  flying gas station  declares mid - air emergency and  vanishes  ,https://www.mirror.co.uk/news/world-news/us-boeing-kc135-stratotanker-missing-37113190,mirror.co.uk,20260505T140000Z,"""persian gulf"" tension"
Gold holds losses on signs that US - Iran ceasefire is fraying,https://www.businesstimes.com.sg/companies-markets/energy-commodities/gold-holds-losses-signs-us-iran-ceasefire-fraying,businesstimes.com.sg,20260505T020000Z,"""persian gulf"" tension"
What are terms of US – Iran Final Draft Deal  brokered  by Pakistan ? ,https://pakobserver.net/what-are-terms-of-us-iran-final-draft-deal-brokered-by-pakistan/,pakobserver.net,20260521T220000Z,"""persian gulf"" tension"
Indian Tanker Clears Hormuz Amid Ship Firing Incidents,https://www.newkerala.com/news/a/safe-passage-indian-tanker-desh-garima-clears-hormuz-310.htm,newkerala.com,20260419T233000Z,"""persian gulf"" tension"
Iran attacks Bahrain and Kuwait following US strikes and threatens to halt talks to end the war,https://www.sun-sentinel.com/2026/06/28/iran-attacks-bahrain-and-kuwait-following-us-strikes-and-threatens-to-halt-talks-to-end-the-war/,sun-sentinel.com,20260628T153000Z,"""persian gulf"" tension"
After the chaos in Hormuz and Trump anger : US and Iran halt attacks and begin new contacts in Doha on 30 / 6,https://www.bankingnews.gr/diethni/articles/884900/after-the-chaos-in-hormuz-and-trump-s-anger-us-and-iran-halt-attacks-and-begin-new-contacts-in-doha-on-30-6,bankingnews.gr,20260629T081500Z,"""persian gulf"" tension"
Oil Prices Climb as Trump Warns of Possible U . S . Strike on Iran,http://www.econotimes.com/Oil-Prices-Climb-as-Trump-Warns-of-Possible-US-Strike-on-Iran-1742250,econotimes.com,20260521T043000Z,"""persian gulf"" tension"
"Massive fuel hike for May : Petrol up R3 . 27 , diesel up R6 . 19",https://www.bizcommunity.com/article/massive-fuel-hike-for-may-petrol-up-r327-diesel-up-r619-069165a,bizcommunity.com,20260504T114500Z,"""persian gulf"" tension"
UAE OPEC Exit May not Hit Oil Market : Executives,https://economictimes.indiatimes.com/epaper/delhicapital/2026/apr/29/et-front/uaes-opec-exit-may-not-hit-oil-mkt-execs/articleshow/130590418.cms,economictimes.indiatimes.com,20260429T010000Z,"""persian gulf"" tension"
"US Army Apache Helicopter Crashes Near Strait Of Hormuz , Crew Survives : What We Know",https://www.newsx.com/world/us-army-apache-helicopter-crashes-near-strait-of-hormuz-crew-survives-what-we-know-232083/,newsx.com,20260609T063000Z,"""persian gulf"" tension"
Iran ceasefire raises hopes for reopening key Strait of Hormuz,https://www.globalissues.org/news/2026/04/08/42731,globalissues.org,20260409T090000Z,"""persian gulf"" tension"
"Trump Claims Iran Nuclear Deal Set for Sunday Signing , Vows to Open Strait of Hormuz",https://www.lankanewspapers.com/2026/06/13/trump-claims-iran-nuclear-deal-set-for-sunday-signing-vows-to-open-strait-of-hormuz,lankanewspapers.com,20260613T183000Z,"""persian gulf"" tension"
"us stocks today : Why are US stock market futures down today , and will S & P 500 , Nasdaq and Dow Jones stay in red or turn green ? Global tensions hit markets",https://economictimes.indiatimes.com/news/international/us/why-are-us-stock-market-futures-down-today-and-will-sp-500-nasdaq-and-dow-jones-stay-in-red-or-turn-green-global-tensions-hit-markets/articleshow/131000973.cms,economictimes.indiatimes.com,20260511T003000Z,"""persian gulf"" tension"
"Pentagon Considers Withdrawing 5 , 000 Troops From Germany Over Iran Tensions",https://www.kyivpost.com/post/75252,kyivpost.com,20260502T103000Z,"""persian gulf"" tension"
"US , Israel responsible for insecurity in Strait of Hormuz : Iran president",https://www.siasat.com/us-israel-responsible-for-insecurity-in-strait-of-hormuz-irans-president-3462630/,siasat.com,20260430T093000Z,"""persian gulf"" tension"
The Persian Gulf topped our 2026 cable risk index . Here what it means for operators and what they can do about it,https://totaltele.com/the-persian-gulf-topped-our-2026-cable-risk-index-heres-what-it-means-for-operators/,totaltele.com,20260526T131500Z,"""persian gulf"" tension"
"UAE Flight Update ( 3 June 2026 ): UAE , Kuwait , Bahrain Flights Suspended , Dubai International Airport on Alert After Iran Missile Attack",https://www.newsx.com/world/uae-flight-update-3-june-2026-uae-kuwait-bahrain-flights-suspended-dubai-international-airport-on-alert-after-iran-missile-attack-229691/,newsx.com,20260603T081500Z,"""persian gulf"" tension"
Captain stranded in the Strait of Hormuz speaks out on being trapped as missile and strikes occur around ships,https://www.abc.net.au/news/2026-04-21/stranded-in-the-strait-of-hormuz/106587880,abc.net.au,20260421T093000Z,"""persian gulf"" tension"
"Macron Urges Europe to  Wake Up  Against United Front from US , Russia , and China",https://www.kyivpost.com/post/74731,kyivpost.com,20260425T124500Z,"""persian gulf"" tension"
Oil Prices Surge Toward $110 Amid U . S .- Iran Tensions,https://athens-times.com/oil-prices-surge-again-brent-heads-toward-110-amid-u-s-iran-tensions/,athens-times.com,20260521T151500Z,"""persian gulf"" tension"
What to know about the Strait of Hormuz and why it matters,https://www.fox5atlanta.com/news/strait-hormuz-important-history,fox5atlanta.com,20260407T214500Z,"""persian gulf"" tension"
Great Nicobar Project emerges as India counter to China regional expansion : Report,https://www.prokerala.com/news/articles/a1762880.html,prokerala.com,20260514T144500Z,"""persian gulf"" tension"
Beyond Hormuz : Why the World Busiest Waterway is the New  Hostage  of Global Trade,https://indianexpress.com/article/world/global-trade-chokepoints-malacca-strait-hormuz-oil-flow-risks-explained-10652078/,indianexpress.com,20260423T163000Z,"""persian gulf"" tension"
US and Iran Pause Strikes but Disagree Over Next Steps on Talks,https://www.military.com/us-and-iran-pause-strikes-but-disagree-over-next-steps-on-talks,military.com,20260629T191500Z,"""persian gulf"" tension"
US Navy to blockade Strait of Hormuz with NATO and united kingdom  helping  operation,https://www.lbc.co.uk/article/trump-strait-hormuz-iran-war-5HjdXc9_2/,lbc.co.uk,20260412T160000Z,"""persian gulf"" tension"
Oil jumps after report Iran suspends communications with U . S . ,https://worldoil.com/news/2026/6/1/oil-jumps-after-report-iran-suspends-communications-with-u-s/,worldoil.com,20260601T150000Z,"""persian gulf"" tension"
US and Iran pause strikes but disagree over next steps on talks,https://abc30.com/post/trump-says-iran-has-requested-meeting-iranian-officials-say-nothing-been-scheduled/19412646/,abc30.com,20260629T183000Z,"""persian gulf"" tension"
Thousands arrested by Iran police as shots fired in  ceasefire  governed Lebanon,https://www.mirror.co.uk/news/world-news/iran-police-arrests-ceasefire-lebanon-37336187,mirror.co.uk,20260623T210000Z,"""persian gulf"" tension"
"When the US shot down Iran Air Flight 655 over the Strait of Hormuz , killing 290",https://economictimes.indiatimes.com/news/new-updates/when-us-shot-down-iran-air-flight-655-killing-290-passengers-over-the-strait-of-hormuz/articleshow/130042880.cms,economictimes.indiatimes.com,20260405T173000Z,"""persian gulf"" tension"
Great Nicobar Project Emerges As India Counter To China Regional Expansion : Report,https://idrw.org/great-nicobar-project-emerges-as-indias-counter-to-chinas-regional-expansion-report/,idrw.org,20260515T053000Z,"""persian gulf"" tension"
"Iran attacks Bahrain , Kuwait after U . S . hits surveillance radar sites",https://www.upi.com/Top_News/US/2026/06/06/iran-bahrain-kuwait-attacks/2471780761631/,upi.com,20260606T164500Z,"""persian gulf"" tension"
"Trump Declares US Hostilities In Iran Have  Terminated , Hints At Military Action In Cuba",https://saharareporters.com/2026/05/02/trump-declares-us-hostilities-iran-have-terminated-hints-military-action-cuba,saharareporters.com,20260502T163000Z,"""persian gulf"" tension"
Hegseth to deliver update after US - Iran clash in Strait of Hormuz,https://upnorthlive.com/news/nation-world/defense-secretary-pete-hegseth-department-of-war-to-deliver-update-after-us-iran-clash-in-strait-of-hormuz-central-command-president-donald-trump-project-freedom-persian-gulf-mines-oil-gas-prices,upnorthlive.com,20260505T121500Z,"""persian gulf"" tension"
PM Modi Addresses Economic Impact of Conflict - Pragativadi I Latest Odisha News in English I Breaking News,https://pragativadi.com/us-iran-war-hits-indian-pockets-pm-modi-issues-urgent-3-point-mandate-to-ministers/,pragativadi.com,20260522T074500Z,"""persian gulf"" tension"
Strait of Hormuz blockade : the complex regional realities the US ignores at its peril,https://www.hindustantimes.com/world-news/us-news/strait-of-hormuz-blockade-the-complex-regional-realities-the-us-ignores-at-its-peril-101776141790191.html,hindustantimes.com,20260414T051500Z,"""persian gulf"" tension"
Shipowners Stay Cautious on Hormuz as Iran Says  Contact Us  ,https://gcaptain.com/shipowners-stay-cautious-on-hormuz-as-iran-says-contact-us/,gcaptain.com,20260506T214500Z,"""persian gulf"" tension"
"US and Iran pause strikes but disagree over next steps on talks - Boston News , Weather , Sports",https://whdh.com/news/us-and-iran-pause-strikes-but-disagree-over-next-steps-on-talks/,whdh.com,20260630T130000Z,"""persian gulf"" tension"
"Chinese Tankers Turn Back from Challenging U . S . Blockade , Others Pass Strait of Hormuz Safely",https://www.breitbart.com/national-security/2026/04/14/chinese-tankers-turn-back-challenging-u-s-blockade-others-pass-strait-hormuz-safely/,breitbart.com,20260415T013000Z,"""persian gulf"" tension"
"US , Iran pause strikes but disagree over next steps on talks",https://www.siasat.com/us-iran-pause-strikes-but-disagree-over-next-steps-on-talks-3498724/,siasat.com,20260630T050000Z,"""persian gulf"" tension"
Iran eyes fees on undersea internet cables in Strait of Hormuz amid US tensions,https://www.moneycontrol.com/world/iran-eyes-fees-on-undersea-internet-cables-in-strait-of-hormuz-amid-us-tensions-article-13922075.html,moneycontrol.com,20260518T053000Z,"""persian gulf"" tension"
Hegseth delivers update after US - Iran clash in Strait of Hormuz,https://wpde.com/news/nation-world/defense-secretary-pete-hegseth-department-of-war-to-deliver-update-after-us-iran-clash-in-strait-of-hormuz-central-command-president-donald-trump-project-freedom-persian-gulf-mines-oil-gas-prices,wpde.com,20260505T124500Z,"""persian gulf"" tension"
"  Maritime security and energy security inseparable , distance from",http://www.asiabulletin.com/news/279092445/maritime-security-and-energy-security-inseparable-distance-from,asiabulletin.com,20260531T004500Z,"""persian gulf"" tension"
Houthi leader warns war likely to continue beyond ceasefire,https://www.middleeasteye.net/live-blog/live-blog-update/houthi-leader-warns-war-likely-continue-beyond-ceasefire,middleeasteye.net,20260421T204500Z,"""houthi"" shipping"
