title,url,domain,seendate,_query
Houthis Declare Total Ban on Israeli Ships in Red Sea : A Threat to Global Shipping | World News,https://timesofindia.indiatimes.com/world/middle-east/houthis-threaten-ban-on-israeli-ships-in-red-sea/articleshow/131599819.cms,timesofindia.indiatimes.com,20260609T050000Z,"""red sea"" shipping"
Yemen Iran - Backed Houthis Threaten Israeli Shipping in the Red Sea,https://www.algemeiner.com/2026/06/08/yemens-iran-backed-houthis-threaten-israeli-shipping-red-sea/,algemeiner.com,20260608T230000Z,"""red sea"" shipping"
"Pilots unhurt as US Apache helicopter crashes near Hormuz , says Trump",https://www.news24.com/world/pilots-unhurt-as-us-apache-helicopter-crashes-near-hormuz-says-trump-20260609-0374,news24.com,20260609T100000Z,"""red sea"" shipping"
EU weighs expanding naval mission to Strait of Hormuz to secure key global shipping routes,https://www.moneycontrol.com/world/eu-weighs-expanding-naval-mission-to-strait-of-hormuz-to-secure-key-global-shipping-routes-article-13917169.html,moneycontrol.com,20260512T173000Z,"""red sea"" shipping"
Saudi Arabia Boosts Red Sea Shipping Routes to Bypass Strait of Hormuz and Strengthen Trade Links,https://gulfnews.com/business/energy/saudi-arabia-now-ships-more-via-red-sea-as-trade-steers-away-from-hormuz-1.500551852,gulfnews.com,20260524T171500Z,"""red sea"" shipping"
Why the Houthis are threatening Red Sea shipping and what it means for oil markets,https://tribune.com.pk/story/2612072/why-the-houthis-are-threatening-red-sea-shipping-and-what-it-means-for-oil-markets,tribune.com.pk,20260608T164500Z,"""red sea"" shipping"
"India Mundra Port joins South Red Sea shipping service connecting Saudi Arabia , Djibouti : Why it matters",https://www.theweek.in/news/maritime/2026/06/06/india-s-mundra-port-joins-south-red-sea-shipping-service-connecting-saudi-arabia-djiouti-why-it-matters.html,theweek.in,20260606T134500Z,"""red sea"" shipping"
Iran Red Sea trade threat shipping crisis : What is Bab el - Mandeb ? The critical trade route Iran threatens to shut down,https://economictimes.indiatimes.com/news/international/us/what-is-bab-el-mandeb-the-critical-trade-route-iran-threatens-to-shut-down/articleshow/130290999.cms,economictimes.indiatimes.com,20260415T220000Z,"""red sea"" shipping"
Houthis declare ban on Israeli ships in Red Sea,https://en.globes.co.il/en/article-houthis-declare-ban-on-israeli-ships-in-red-sea-1001545248,en.globes.co.il,20260608T101500Z,"""red sea"" shipping"
New oil lifeline ? How Red Sea route via Bab el - Mandeb is emerging as an alternative to Strait of Hormuz,https://www.moneycontrol.com/world/new-oil-lifeline-how-red-sea-route-via-bab-el-mandeb-is-emerging-as-an-alternative-to-strait-of-hormuz-article-13881562.html,moneycontrol.com,20260406T171500Z,"""red sea"" shipping"
"Fast Red Sea shipping line linking 4 Saudi , regional ports : Folk Maritime tells Al - Eqtisadiah",https://www.arabnews.com/node/2647266/business-economy,arabnews.com,20260615T144500Z,"""red sea"" shipping"
Global trade faces  two - front crisi as Trump war sparks second strait blockade,https://www.rawstory.com/iran-war-2677010127/,rawstory.com,20260608T143000Z,"""red sea"" shipping"
Suez Canal Gets Oil Tanker Boost,https://www.rigzone.com/news/wire/suez_canal_gets_oil_tanker_boost-10-jun-2026-183895-article/,rigzone.com,20260610T171500Z,"""red sea"" shipping"
Suez Canal sees oil tanker surge amid Strait of Hormuz disruption,https://economictimes.indiatimes.com/news/international/world-news/suez-canal-revenues-surge-as-oil-tanker-traffic-increases-amid-hormuz-disruption/articleshow/131630993.cms,economictimes.indiatimes.com,20260610T101500Z,"""red sea"" shipping"
Saudi Arabia presses US to rethink Hormuz blockade as Iran threat shifts to Red Sea,https://www.moneycontrol.com/world/saudi-arabia-presses-us-to-rethink-hormuz-blockade-as-iran-threat-shifts-to-red-sea-article-13888231.html,moneycontrol.com,20260414T081500Z,"""red sea"" shipping"
Houthis renew Red Sea blockade on Israel,https://www.ynetnews.com/article/hkk7z1nzmx,ynetnews.com,20260608T113000Z,"""red sea"" shipping"
"Hormuz shut , shipping services through other routes to West Asia up 2x",https://timesofindia.indiatimes.com/india/hormuz-shut-shipping-services-through-other-routes-to-west-asia-up-2x/articleshow/131473482.cms,timesofindia.indiatimes.com,20260602T234500Z,"""red sea"" shipping"
Strait Of Hormuz : An alternative to the Strait of Hormuz ? Why Iran is eyeing Yemen Bab al - Mandab,https://timesofindia.indiatimes.com/world/middle-east/an-alternative-to-the-strait-of-hormuz-why-iran-is-eyeing-yemens-bab-al-mandab/articleshow/131453144.cms,timesofindia.indiatimes.com,20260602T041500Z,"""red sea"" shipping"
Yemen Houthis declare ban on Israeli shipping in Red Sea : statement,https://www.omanobserver.om/article/1190880/world/region/yemens-houthis-declare-ban-on-israeli-shipping-in-red-sea-statement,omanobserver.om,20260608T091500Z,"""red sea"" shipping"
EU envoy seeks more vessels to secure Hormuz navigation once the war in Iran ends,https://www.yahoo.com/news/world/articles/eu-envoy-seeks-more-vessels-164326256.html,yahoo.com,20260528T171500Z,"""red sea"" shipping"
"If Iran and the Houthis Keep Fighting , the US Will Be Forced to Escalate",https://www.theepochtimes.com/opinion/if-iran-and-the-houthis-keep-fighting-the-us-will-be-forced-to-escalate-6010265,theepochtimes.com,20260411T060000Z,"""red sea"" shipping"
Yemen Houthis vow attacks on Israeli vessels in Red Sea,https://www.khaama.com/yemens-houthis-vow-attacks-on-israeli-vessels-in-red-sea/,khaama.com,20260608T101500Z,"""red sea"" shipping"
EU seeks more vessels to secure Hormuz navigation,https://jamaica-gleaner.com/article/world-news/20260529/eu-seeks-more-vessels-secure-hormuz-navigation,jamaica-gleaner.com,20260529T143000Z,"""red sea"" shipping"
"Houthis Attack Israel , Declare Ban on Israeli Shipping in Red Sea",https://english.aawsat.com/arab-world/5281549-houthis-attack-israel-declare-ban-israeli-shipping-red-sea,english.aawsat.com,20260608T073000Z,"""red sea"" shipping"
"Hormuz , Suez , Taiwan Strait : Why the world supply chains now need war - room planning",https://timesofindia.indiatimes.com/world/middle-east/hormuz-suez-taiwan-strait-why-the-worlds-supply-chains-now-need-war-room-planning/articleshow/132088888.cms,timesofindia.indiatimes.com,20260630T104500Z,"""red sea"" shipping"
9th Korean oil tanker successfully transits Red Sea,https://www.koreatimes.co.kr/business/20260614/9th-korean-oil-tanker-successfully-transits-red-sea,koreatimes.co.kr,20260614T093000Z,"""red sea"" shipping"
Stronger alliance with Eritrea - Egypt - Al - Ahram Weekly,https://english.ahram.org.eg/News/569257.aspx,english.ahram.org.eg,20260608T083000Z,"""red sea"" shipping"
EU envoy seeks more vessels to secure Hormuz navigation once the war in Iran ends – Winnipeg Free Press,https://www.winnipegfreepress.com/business/2026/05/28/eu-envoy-seeks-more-vessels-to-secure-hormuz-navigation-once-the-war-in-iran-ends,winnipegfreepress.com,20260528T173000Z,"""red sea"" shipping"
Houthis Declare  Total Ban  On Israeli Ships As Dual Chokepoint Crisis Stokes Supply Chain Nightmare,https://www.zerohedge.com/commodities/houthis-declare-total-ban-israeli-ships-dual-chokepoint-crisis-stokes-supply-chain,zerohedge.com,20260608T113000Z,"""red sea"" shipping"
South Korea opposes Iran reported plan to charge Hormuz transit fees,https://tribune.com.pk/story/2608443/south-korea-opposes-irans-reported-plan-to-charge-hormuz-transit-fees,tribune.com.pk,20260516T083000Z,"""red sea"" shipping"
Somali piracy threatens ships rerouted from Middle East,https://www.dw.com/en/somali-piracy-global-shippings-next-crisis-unfolds-in-the-indian-ocean/a-77047750,dw.com,20260511T110000Z,"""red sea"" shipping"
Israel and Iran Renew Direct Hostilities,https://time.com/article/2026/06/08/israel-iran-war-direct-attacks-latest-ceasefire-trump-netanyahu-lebanon/,time.com,20260608T113000Z,"""red sea"" shipping"
"Houthis claim attack on Israel , threatens to target Israel - affiliated vessels in Red Sea",https://www.naharnet.com/stories/en/320557-houthis-claim-attack-on-israel-threatens-to-target-israel-affiliated-vessels-in-red-sea,naharnet.com,20260608T073000Z,"""red sea"" shipping"
"Houthis claim attack on Israel , threaten to target Israel - affiliated vessels in Red Sea",https://www.naharnet.com/stories/en/320557-houthis-claim-attack-on-israel-threaten-to-target-israel-affiliated-vessels-in-red-sea,naharnet.com,20260608T120000Z,"""red sea"" shipping"
Bab el - Mandeb may prove to be the gate of tears for US - Israel Camp,https://www.dailyexcelsior.com/bab-el-mandeb-may-prove-to-be-the-gate-of-tears-for-us-israel-camp/,dailyexcelsior.com,20260404T233000Z,"""red sea"" shipping"
Iran war escalates as Houthis threaten to sever Saudi oil exports,https://www.scmp.com/week-asia/politics/article/3350671/iran-war-escalates-houthis-threaten-sever-saudi-oil-exports,scmp.com,20260420T043000Z,"""red sea"" shipping"
Another Hormuz ? The Red Sea Threat to the Global Economy | Council on Foreign Relations,https://www.cfr.org/articles/another-hormuz-the-red-seas-threat-to-the-global-economy,cfr.org,20260625T014500Z,"""red sea"" shipping"
MSC plans new shipping route bypassing Strait of Hormuz,https://sana.sy/en/international/2314330/,sana.sy,20260504T020000Z,"""red sea"" shipping"
How the Looming Houthi Threat Could Turn the Iran War,https://www.washingtoninstitute.org/policy-analysis/how-looming-houthi-threat-could-turn-iran-war,washingtoninstitute.org,20260609T180000Z,"""red sea"" shipping"
South Korea opposes Iran reported plan to charge Hormuz transit fees – Middle East Monitor,https://www.middleeastmonitor.com/20260516-south-korea-opposes-irans-reported-plan-to-charge-hormuz-transit-fees/,middleeastmonitor.com,20260516T110000Z,"""red sea"" shipping"
Red Sea tensions could push grocery bills higher,https://www.bnnbloomberg.ca/investing/market-outlook/2026/06/22/market-outlook-strait-of-hormuz-tensions-could-raise-energy-costs/,bnnbloomberg.ca,20260622T183000Z,"""red sea"" shipping"
Egyptian port container traffic jumps 24 . 3 % in 2025 amid transit trade boom : Transport Ministry - Urban & Transport - Egypt,https://english.ahram.org.eg/News/569773.aspx,english.ahram.org.eg,20260609T111500Z,"""red sea"" shipping"
"Maersk First - quarter Profit Beats Forecasts , Keeps Outlook Unchanged",https://english.aawsat.com/business/5270502-maersk-first-quarter-profit-beats-forecasts-keeps-outlook-unchanged,english.aawsat.com,20260507T080000Z,"""red sea"" shipping"
Bab el - Mandeb : Next trade shock ? ,https://mumbaimirror.indiatimes.com/mumbai/bab-el-mandeb-next-trade-shock/articleshow/130041962.html,mumbaimirror.indiatimes.com,20260405T231500Z,"""red sea"" shipping"
Maersk tests return to Suez route as Red Sea conditions improve,https://www.freshplaza.com/north-america/article/9848488/maersk-tests-return-to-suez-route-as-red-sea-conditions-improve/,freshplaza.com,20260618T141500Z,"""red sea"" shipping"
Germany Deploys Vessels To The Red Sea For Possible,https://www.marinelink.com/news/germany-deploys-vessels-red-sea-possible-540461,marinelink.com,20260618T201500Z,"""red sea"" shipping"
Why are Houthis threatening to attack Red Sea shipping ; what does it mean for oil ? ,https://article.wn.com/view/2026/06/08/Why_are_Houthis_threatening_to_attack_Red_Sea_shipping_what_/,article.wn.com,20260608T143000Z,"""red sea"" shipping"
Iran - Backed Houthi Terrorists Threaten to  Ban  Israel from Red Sea,https://www.breitbart.com/middle-east/2026/06/08/iran-backed-houthi-terrorists-threaten-to-ban-israel-from-red-sea/,breitbart.com,20260609T000000Z,"""red sea"" shipping"
Port Of NEOM Offers Alternative Route For Gulf,https://www.marinelink.com/news/port-neom-offers-alternative-route-gulf-539863,marinelink.com,20260602T174500Z,"""red sea"" shipping"
Surface Forces : Red Sea Failures And The Strait of Hormuz,http://www.strategypage.com/%5Chtmw%5Chtsurf%5Carticles%5C2026042441740.aspx,strategypage.com,20260425T044500Z,"""red sea"" shipping"
Europe – Red Sea – Middle East Express service launches from Antwerp,https://www.freshplaza.com/north-america/article/9834567/europe-red-sea-middle-east-express-service-launches-from-antwerp/,freshplaza.com,20260504T164500Z,"""red sea"" shipping"
Somalia : U . S . State Department Highlights Somaliland Strategic Value,https://allafrica.com/stories/202606020045.html,allafrica.com,20260602T054500Z,"""red sea"" shipping"
The Latest : Israel and Iran trade fire in most serious confrontation since April truce,http://www.idahopress.com/ap_news/us/the-latest-israel-and-iran-trade-fire-in-most-serious-confrontation-since-april-truce/article_159cd206-dca6-5d18-a5d2-14a5a4a78264.html,idahopress.com,20260608T083000Z,"""red sea"" shipping"
Djibouti holds election as longtime ruler set to secure sixth term after scrapping presidential age limits,https://www.independent.co.uk/news/world/africa/djibouti-election-africa-ismail-omar-guelleh-b2955149.html,independent.co.uk,20260410T151500Z,"""red sea"" shipping"
"Sri Lankan buyer paid $286 for barrel of oil , as actual prices diverge from markets",https://www.middleeasteye.net/news/sri-lanka-buyer-paid-286-barrel-oil-actual-prices-world-diverge-markets,middleeasteye.net,20260415T221500Z,"""red sea"" shipping"
Somali piracy adds new strain to global shipping and trade routes,https://www.malaysiakini.com/news/774884,malaysiakini.com,20260511T123000Z,"""red sea"" shipping"
Why Port Efficiency Matters More Than Ever Amid Global Shipping Disruptions,https://gcaptain.com/why-port-efficiency-matters-more-than-ever-amid-global-shipping-disruptions/,gcaptain.com,20260610T213000Z,"""red sea"" shipping"
Djibouti holds presidential election with longtime ruler favored for a sixth term,https://abcnews.com/International/wireStory/djibouti-holds-presidential-election-longtime-ruler-favored-sixth-131907189,abcnews.com,20260410T133000Z,"""red sea"" shipping"
KSA Business : Red Sea Express shipping service launched,https://www.gdnonline.com:443/Details/1395333,gdnonline.com,20260520T071500Z,"""red sea"" shipping"
UAE Business : AD Ports boosts majority stake in Global Feeder Shipping to 81pc,https://www.gdnonline.com:443/Details/1398608,gdnonline.com,20260624T101500Z,"""red sea"" shipping"
"New Shipping Service Connects Jeddah Islamic Port with China , Malaysia and Egypt",https://english.aawsat.com/business/5267736-new-shipping-service-connects-jeddah-islamic-port-china-malaysia-and-egypt,english.aawsat.com,20260429T111500Z,"""red sea"" shipping"
Djibouti holds presidential election with longtime ruler favored for a sixth term – Winnipeg Free Press,https://www.winnipegfreepress.com/world/2026/04/10/djibouti-holds-presidential-election-with-longtime-ruler-favored-for-a-sixth-term,winnipegfreepress.com,20260410T071500Z,"""red sea"" shipping"
China Calls for Permanent Truce in West Asia And Urgent Reopening of Key Shipping Lanes,https://www.outlookindia.com/international/china-calls-for-permanent-truce-in-west-asia-and-urgent-reopening-of-key-shipping-lanes,outlookindia.com,20260515T200000Z,"""red sea"" shipping"
Iran ship seizures not a violation : White House,https://www.argusmedia.com/en/news-and-insights/latest-market-news/2818158-iran-s-ship-seizures-not-a-violation-white-house,argusmedia.com,20260423T211500Z,"""red sea"" shipping"
Houthis Ban Israeli Shipping in Red Sea : New Crisis,https://www.newkerala.com/news/a/red-sea-chokehold-houthis-declare-total-ban-israeli-178.htm,newkerala.com,20260608T084500Z,"""red sea"" shipping"
Iran Guards threaten  new front over Israel Lebanon offensive,https://www.naharnet.com:443/stories/en/320420-iran-guards-threaten-new-fronts-over-israel-s-lebanon-offensive,naharnet.com,20260601T223000Z,"""red sea"" shipping"
Mitsotakis at Posidonia : Greece Will Use UN Security Council Seat to Push for Hormuz Reopening,https://www.iefimerida.gr/english/mitsotakis-posidonia,iefimerida.gr,20260602T061500Z,"""red sea"" shipping"
Shipping industry enters a state of heightened uncertainty,https://www.inewsgr.com/3/Shipping-industry-enters-a-state-of-heightened-uncertainty.htm,inewsgr.com,20260407T070000Z,"""red sea"" shipping"
Egypt – Italy cargo route gains traction as firms seek alternatives to disrupted trade,https://www.euronews.com/business/2026/04/20/egyptitaly-cargo-route-gains-traction-as-firms-seek-alternatives-to-disrupted-trade,euronews.com,20260420T150000Z,"""red sea"" shipping"
Aramco CEO Warns 1 Billion Barrels Lost Will Slow Oil Market Recovery,https://english.aawsat.com/business/5271530-aramco-ceo-warns-1-billion-barrels-lost-will-slow-oil-market-recovery,english.aawsat.com,20260510T110000Z,"""red sea"" shipping"
How Strait of Hormuz blockage is reshaping oil flows from Saudi Arabia,https://www.moneycontrol.com/world/how-strait-of-hormuz-blockage-is-reshaping-oil-flows-from-saudi-arabia-article-13898868.html,moneycontrol.com,20260424T144500Z,"""red sea"" shipping"
Yemen reports hijacked oil tanker headed for Somalia,https://www.aljazeera.com/news/2026/5/2/yemen-reports-hijacked-oil-tanker-headed-for-somalia,aljazeera.com,20260502T184500Z,"""red sea"" tanker"
Suspected pirates steer cargo vessel towards Somalia,https://www.aljazeera.com/news/2026/4/27/suspected-pirates-steer-cargo-vessel-towards-somalia,aljazeera.com,20260427T180000Z,"""red sea"" tanker"
First oil tanker in weeks heads to Korea via Hormuz strait,https://www.koreaherald.com:443/article/10721068,koreaherald.com,20260420T090000Z,"""red sea"" tanker"
UK maritime agency reports armed attack on tanker off Yemen,https://aa.com.tr/en/middle-east/uk-maritime-agency-reports-armed-attack-on-tanker-off-yemen/3967801,aa.com.tr,20260615T184500Z,"""red sea"" tanker"
Oil Flows from Saudi Port Steady for Now despite Attack,https://www.rigzone.com/news/wire/oil_flows_from_saudi_port_steady_for_now_despite_attack-11-apr-2026-183425-article/,rigzone.com,20260411T011500Z,"""red sea"" tanker"
Pakistan - flagged tanker becomes 1st crude carrier to exit Hormuz with cargo since US blockade,https://aa.com.tr/en/asia-pacific/pakistan-flagged-tanker-becomes-1st-crude-carrier-to-exit-hormuz-with-cargo-since-us-blockade/3908845,aa.com.tr,20260417T094500Z,"""red sea"" tanker"
Suez Canal revenues rise as tanker traffic rebounds amid shipping route shifts,https://www.domain-b.com/economy/trade/suez-canal-revenues-rise-tanker-traffic-recovery-2026,domain-b.com,20260610T144500Z,"""red sea"" tanker"
Oil exports through Hormuz might not return to levels before Iran war,https://www.cnbc.com/2026/05/30/oil-exports-through-hormuz-might-not-return-to-levels-before-iran-war.html,cnbc.com,20260530T133000Z,"""red sea"" tanker"
Risks to Red Sea Oil Exports Could Roil Oil Market Further,https://oilprice.com/Energy/Crude-Oil/Risks-to-Red-Sea-Oil-Exports-Could-Roil-Oil-Market-Further.html,oilprice.com,20260609T000000Z,"""red sea"" tanker"
Oil tanker hijacked off Somalia - maritime agency,https://www.rte.ie/news/2026/0425/1570184-somalia-tanker/,rte.ie,20260425T171500Z,"""red sea"" tanker"
International Business Times Korea,https://kr.ibtimes.com/,kr.ibtimes.com,20260511T214500Z,"""red sea"" tanker"
Saudi Arabia Restarts Crude Loadings at Major Gulf Terminal After Nearly Four - Month Halt,https://www.morningstar.com/news/dow-jones/202606261765/saudi-arabia-restarts-crude-loadings-at-major-gulf-terminal-after-nearly-four-month-halt,morningstar.com,20260626T103000Z,"""red sea"" tanker"
Iran threatens to strike if the US resumes attacks,https://www.bostonglobe.com/2026/05/20/world/iran-us-war/,bostonglobe.com,20260520T234500Z,"""red sea"" tanker"
Japan Receives First Central Asian Crude Since Iran War Began,https://oilprice.com/Latest-Energy-News/World-News/Japan-Receives-First-Central-Asian-Crude-Since-Iran-War-Began.html,oilprice.com,20260511T131500Z,"""red sea"" tanker"
Analysis : The US Protected Ships From Iran In The Strait Of Hormuz In The  80s . Could It Again ? – The Yeshiva World,https://www.theyeshivaworld.com/news/general/2540119/analysis-the-us-protected-ships-from-iran-in-the-strait-of-hormuz-in-the-80s-could-it-again.html,theyeshivaworld.com,20260426T221500Z,"""red sea"" tanker"
Finland charges Russian captain and crew member of ship suspected of damaging undersea cables prosecutors claim ship had eight more targets before it was stopped by coast guard,https://www.tomshardware.com/networking/finland-charges-russian-captain-and-crew-member-of-ship-suspected-of-damaging-undersea-cables-prosecutors-claim-ship-had-eight-more-targets-before-it-was-stopped-by-coast-guard,tomshardware.com,20260616T140000Z,"""red sea"" tanker"
Heidmar CEO On Tanker Rates Amid Gulf Disruption - Heidmar Maritime Holdings ( NASDAQ : HMR ) ,https://www.benzinga.com/Opinion/26/04/52040254/heidmar-ceo-on-tanker-rates-amid-gulf-disruption,benzinga.com,20260424T171500Z,"""red sea"" tanker"
"Three Saudi - Flagged Supertankers Sail Through Hormuz After Iran Deal Signed , Data Shows",https://gcaptain.com/three-saudi-flagged-supertankers-sail-through-hormuz-after-iran-deal-signed-data-shows/,gcaptain.com,20260618T151500Z,"""red sea"" tanker"
The Latest : A 10 - day Lebanon ceasefire appears to hold as European leaders set to meet over strait,https://www.yahoo.com/news/articles/latest-10-day-lebanon-ceasefire-054547738.html,yahoo.com,20260417T061500Z,"""red sea"" tanker"
"Japan refiners deploy VLCCs for ship transfers , US crude amid Hormuz disruptions",https://www.hellenicshippingnews.com/japan-refiners-deploy-vlccs-for-ship-transfers-us-crude-amid-hormuz-disruptions/,hellenicshippingnews.com,20260611T121500Z,"""red sea"" tanker"
Saudi Arabia urges U . S . to lift Hormuz blockade amid fears of escalation in Bab al - Mandab – NaturalNews . com,https://www.naturalnews.com/2026-04-15-saudi-arabia-urges-us-to-lift-hormuz-blockade.html,naturalnews.com,20260415T211500Z,"""red sea"" tanker"
  We Must Act : TotalEnergies CEO Joins Calls To Rewire Gulf Energy Flows Around Hormuz,https://www.zerohedge.com/energy/we-must-act-totalenergies-ceo-joins-calls-rewire-gulf-energy-flows-around-hormuz,zerohedge.com,20260624T040000Z,"""red sea"" tanker"
"100 , 000 tonnes of crude oil to reach Ctg Port on May 5 : official",https://www.bssnews.net/news/381368,bssnews.net,20260425T171500Z,"""red sea"" tanker"
Somali pirates abandon hijacked UAE dhow due to dwindling supplies,https://www.aljazeera.com/news/2026/5/7/somali-pirates-abandon-hijacked-uae-dhow-due-to-dwindling-supplies,aljazeera.com,20260507T134500Z,"""red sea"" tanker"
Saudi Arabia Resumes Crude Oil Loadings at Ras Tanura Port,https://www.breitbart.com/middle-east/2026/06/26/saudi-arabia-resumes-crude-oil-loadings-ras-tanura-port/,breitbart.com,20260627T043000Z,"""red sea"" tanker"
"Heat Index at  Caution level  at some places in the Northern , North - central , Eastern , Sabaragamuwa , North - western provinces and in Colombo , Gampaha and Monaragala districts during the day time – The Island",https://island.lk/heat-index-at-caution-level-at-some-places-in-the-northern-north-central-eastern-sabaragamuwa-north-western-provinces-and-in-colombo-gampaha-and-monaragala-districts-during-the/,island.lk,20260502T220000Z,"""red sea"" tanker"
Armed Security Team Repels Suspected Pirate Attack Off Yemen,https://gcaptain.com/armed-security-team-repels-suspected-pirate-attack-off-yemen/,gcaptain.com,20260610T213000Z,"""red sea"" tanker"
Analysis : The US protected ships from Iran in the Strait of Hormuz in the  80s . Could it again ? ,https://www.wral.com/news/ap/5df20-analysis-the-us-protected-ships-from-iran-in-the-strait-of-hormuz-in-the-80s-could-it-again/,wral.com,20260424T081500Z,"""red sea"" tanker"
Somali pirates raise ransom demand for hijacked tanker carrying Egyptian sailors,https://www.middleeastmonitor.com/20260513-somali-pirates-raise-ransom-demand-for-hijacked-tanker-carrying-egyptian-sailors/,middleeastmonitor.com,20260513T140000Z,"""red sea"" tanker"
Gulf oil exports surge as Saudi Arabia restarts key terminal after four - month halt,https://www.albawaba.com/business/gulf-oil-exports-surge-saudi-arabia-1631396,albawaba.com,20260626T180000Z,"""red sea"" tanker"
The Latest : A 10 - day Lebanon ceasefire appears to hold as European leaders set to meet over strait – Winnipeg Free Press,https://www.winnipegfreepress.com/arts-and-life/life/faith/2026/04/17/the-latest-a-10-day-lebanon-ceasefire-appears-to-hold-as-european-leaders-set-to-meet-over-strait,winnipegfreepress.com,20260417T061500Z,"""red sea"" tanker"
Piracy Surges off Somali Coast | Radio Dalsan,http://radiodalsan.com/2026/05/05/piracy-surges-off-somali-coast/,radiodalsan.com,20260505T091500Z,"""red sea"" tanker"
French aircraft carrier edges closer to Strait of Hormuz as Trump sends warning to Iran | World | News,https://www.express.co.uk/news/world/2202613/french-aircraft-carrier-edges-closer-strait-of-hormuz-trump-iran,express.co.uk,20260506T214500Z,"""red sea"" tanker"
Hijackings off Somalia raise fears that piracy is back on the rise,https://www.modernghana.com/news/1490161/hijackings-off-somalia-raise-fears-that-piracy.html,modernghana.com,20260502T194500Z,"""red sea"" tanker"
Yemen reports hijacked oil tanker headed for Somalia - Grenada Chronicle – Daily Grenada And Caribbean News,https://grenadachronicle.com/yemen-reports-hijacked-oil-tanker-headed-for-somalia/,grenadachronicle.com,20260502T184500Z,"""red sea"" tanker"
Report : Somali Pirates Team Up with Houthi Terrorists to Attack Key Oil Trade Route,https://www.breitbart.com/africa/2026/05/04/report-somali-pirates-team-up-with-houthi-terrorists-to-attack-key-oil-trade-route/,breitbart.com,20260505T013000Z,"""red sea"" tanker"
S . Korean oil tanker completes Red Sea transit safely,https://news.az/news/s-korean-oil-tanker-completes-red-sea-transit-safely,news.az,20260508T124500Z,"""red sea"" tanker"
